1,Merry Winston,12/magata<n>112233,merry@gmail.com,"Merry1234@bank",09998878787,"Yangon, South Dagon",435850,900000,0,0,0,1,1,0,0,2023,5,27,1688915261,0,1000000,10000MMK transferred to Peter Oo[Jul-08-2023-09:42PM],50000MMK recieved from Peter Oo[Jun-28-2023-10:12PM],100000MMK saved in the account[Jul-08-2023-09:40PM]|300000MMK saved in the account[Jul-08-2023-09:45PM],5000MMK withdrawn from the account[Jul-08-2023-09:44PM],,,Name changed from Merry Win to Merry Winston[Jul-09-2023-08:27PM]|Address changed from Mandalay to Yangon[Jul-09-2023-08:28PM],
2,Nana,12/nal<n>223323,nana@gmail.com,"Nana1234@bank",09464233234,"Kansus, Lawrance",510300,1000000,0,0,0,1,1,0,0,2023,6,8,1688912175,0,1000000,20000MMK transferred to Kenedy Blair[Jul-09-2023-08:50PM],50000MMK recieved from Peter Oo[Jul-09-2023-03:00PM]|30000MMK recieved from Steller Win[Jul-09-2023-10:07PM],500000MMK saved in the account[Jul-09-2023-03:01PM],50000MMK withdrawn from the account[Jul-09-2023-03:01PM],,,Address changed from NYC to Kansus,
3,Steller Win,9/paoola<N>231234,win@gmail.com,"Win1234@bank",09994455342,"Pyin Oo Lwin",470700,1500000,0,0,0,0,1,0,0,2023,6,9,1688916943,0,10000000,30000MMK transferred to Nana[Jul-09-2023-10:07PM],,500000MMK saved in the account[Jul-09-2023-10:06PM],,,,,
4,Henry Htun,12/magata<N>234567,henry@gmail.com,"Henry1234@bank",09898945654,"Rangoon",601000,600000,0,0,0,0,1,0,0,2023,6,9,1688891859,0,10000000,,,600000MMK saved in the account[Jul-09-2023-03:08PM],,,,,
5,Kyaw Min Oo,12/thalana<n>117395,peter@gmail.com,"Peter1234@bank",09999999999,"Yangon",893998,1000000,499999,119999,1,1,1,1,0,2023,5,27,1688921787,0,1000000,50000MMK transferred to Merry Win[Jun-28-2023-10:12PM]|50000MMK transferred to Nana[Jul-09-2023-03:00PM],100000MMK recieved from Amily Win[Jun-28-2023-10:48PM]|10000MMK recieved from Merry Win[Jul-08-2023-09:42PM],100000MMK saved in the account[Jun-28-2023-10:11PM]|9999MMK saved in the account[Jun-28-2023-10:50PM],100000MMK withdrawn from the account[Jun-27-2023-10:52PM],400000MMK burrowed from the bank[Jul-08-2023-09:48PM],20000MMK repaid to the bank[Jul-08-2023-09:58PM],Name changed from Peter Oo to Kyaw Min Oo[Jul-09-2023-07:25PM]|Password changed[Jul-09-2023-07:34PM]|Password changed[Jul-09-2023-09:48PM],
6,willian Blair,12/nyc<n>112233,kenedy@gmail.com,"Kenedy1234@bank",09957734546,"LOS ANGELES,USA",400799,2000000,0,0,0,1,1,0,0,2023,6,2,1688912483,0,1000000,,20000MMK recieved from Nana[Jul-09-2023-08:50PM],400000MMK saved in the account[Jul-09-2023-08:52PM],20000MMK withdrawn from the account[Jul-09-2023-08:52PM],,,Name changed from Kenedy Blair to willian Blair[Jul-09-2023-08:53PM]|Address changed from NYC to LOS ANGELES,
